name,url,profile,additional_urls
Stephen Boyd,https://icme.stanford.edu/people/stephen-boyd,"Main content start Samsung Professor in the School of Engineering Stephen Boyd Samsung Professor in the School of Engineering Stephen P. Boyd is the Samsung Professor of Engineering, and Professor of Electrical Engineering in the Information Systems Laboratory at Stanford University, and a member of the Institute for Computational and Mathematical Engineering. His current research focus is on convex optimization applications in control, signal processing, machine learning, and finance. Professor Boyd received an AB degree in Mathematics, summa cum laude, from Harvard University in 1980, and a PhD in EECS from U. C. Berkeley in 1985. In 1985 he joined  Stanford's Electrical Engineering Department. He has held visiting Professor positions at Katholieke University (Leuven), McGill University (Montreal), Ecole Polytechnique Federale (Lausanne), Tsinghua University (Beijing), Universite Paul Sabatier (Toulouse), Royal Institute of Technology (Stockholm), Kyoto University, Harbin Institute of Technology, NYU, MIT, UC Berkeley, CUHK-Shenzhen, and IMT Lucca.  He holds honorary doctorates from Royal Institute of Technology (KTH), Stockholm, and Catholic University of Louvain (UCL). Professor Boyd is the author of many research articles and four books: Introduction to Applied Linear Algebra: Vectors, Matrices, and Least-Squares (with Lieven Vandenberghe, 2018), Convex Optimization (with Lieven Vandenberghe, 2004), Linear Matrix Inequalities in System and Control Theory (with El Ghaoui, Feron, and Balakrishnan, 1994), and Linear Controller Design: Limits of Performance (with Craig Barratt, 1991). His group has produced many open source tools, including CVX (with Michael Grant), CVXPY (with Steven Diamond) and Convex.jl (with Madeleine Udell and others), widely used parser-solvers for convex optimization. He has received many awards and honors for his research in control systems engineering and optimization, including an ONR Young Investigator Award, a Presidential Young Investigator Award, and the AACC Donald P. Eckman Award. In 2013, he received the IEEE Control Systems Award, given for outstanding contributions to control systems engineering, science, or technology. In 2012, Michael Grant and he were given the Mathematical Optimization Society's Beale-Orchard-Hays Award, for excellence in computational mathematical programming.  In 2023, he was given the AACC Richard E. Bellman Control Heritage Award, the highest recognition of professional achievement for U.S. control systems engineers and scientists.  He is a Fellow of the IEEE, SIAM, INFORMS, and IFAC, a Distinguished Lecturer of the IEEE Control Systems Society, a member of the US National Academy of Engineering, a foreign member of the Chinese Academy of Engineering, and a foreign member of the National Academy of Engineering of Korea.  He has been invited to deliver more than 90 plenary and keynote lectures at major conferences in control, optimization, signal processing, and machine learning. He has developed and taught many undergraduate and graduate courses, including Signals & Systems, Linear Dynamical Systems, Convex Optimization, and a recent undergraduate course on Matrix Methods. His graduate convex optimization course attracts around 300 students from more than 20 departments. In 1991 he received an ASSU Graduate Teaching Award, and in 1994 he received the Perrin Award for Outstanding Undergraduate Teaching in the School of Engineering. In 2003, he received the AACC Ragazzini Education award, for contributions to control education. In 2016 he received the Walter J. Gores award, the highest award for teaching at Stanford University.  In 2017 he received the IEEE James H. Mulligan, Jr. Education Medal, for a career of outstanding contributions to education in the fields of interest of IEEE, with citation ""For inspirational education of students and researchers in the theory and application of optimization."" Education PhD, UC Berkeley, EECS  (1985) BA, Harvard University, Mathematics  (1980) Contact (650) 723-0002 Stephen.Boyd@stanford.edu Mail Code 9510 Links Research web page Google scholar Papers Books View Full Stanford Profile Back to Top",https://web.stanford.edu/~boyd
Margot Gerritsen,https://icme.stanford.edu/people/margot-gerritsen,"Main content start Professor of Energy Resources Engineering, Emerita Margot Gerritsen Professor of Energy Resources Engineering, Emerita I was born and raised in the Netherlands. After receiving my MS degree in Applied Mathematics at the University of Delft, I moved to the U.S. in search of hillier and sunnier places. In 1996 I received my Ph.D. in Scientific Computing and Computational Mathematics at Stanford University. Before returning to Stanford in 2001, I spent nearly five years in Auckland, New Zealand as a faculty member in the Department of Engineering Science. I’m a professor in the Department of Energy Resources Engineering at Stanford, interested in computer simulation and mathematical analysis of engineering and natural processes. From 2010 to 2018, I directed the Institute for Computational and Mathematical Engineering ( http://icme.stanford.edu ). Since 2015, I'm the Senior Associate Dean for Educational Affairs in the School of Earth, Energy and Environmental Sciences, as well as the co-director of Women in Data Science (WiDS, widsconference.org) and the host of the WiDS podcasts. My primary interests are in sustainability, and renewable and fossil energy production. I am also active in coastal ocean dynamics and yacht design, as well as several areas in computational mathematics including search algorithm design and matrix computations. My latest research projects include traffic congestion and emissions simulation and mitigation, and wildland fire prediction and mitigation. Education PhD, Stanford University, Scientific Computing and Computational Mathematics  (1997) MSc, Delft University of Technology, Applied Mathematics  (1990) Contact (650) 725-2727 margot.gerritsen@stanford.edu Mail Code 5017 Links Gerritsen Research Computational and Mathematical Engineering Computational Approaches to Digital Stewardship Personal Website View Full Stanford Profile Back to Top",https://earth.stanford.edu/ere/about/energy-resources-engineering-faculty#gs.wtgaez
Hamdi Tchelepi,https://icme.stanford.edu/people/hamdi-tchelepi,"Main content start Max Steineke Professor and Senior Fellow at the Precourt Institute for Energy Hamdi Tchelepi Max Steineke Professor and Senior Fellow at the Precourt Institute for Energy Education Ph.D., Stanford University, Petroleum Engineering  (1994) M.S., King Fahd University, Petroleum Engineering  (1988) B.S., University of Petroleum and Minerals, Petroleum Engineering  (1985) Contact (650) 723-9476 tchelepi@stanford.edu Mail Code 2220 Links SUPRI-B: Reservoir Simulation View Full Stanford Profile Back to Top",https://supri-b.stanford.edu/
Biondo Biondi,https://icme.stanford.edu/people/biondo-biondi,"Main content start Barney and Estelle Morris Professor Biondo Biondi Barney and Estelle Morris Professor My students and I devise new algorithms to improve the imaging of active and passive seismic data. Images obtained from seismic data are the primary source of information on the structural and stratigraphic complexities in Earth's subsurface and on many subsurface dynamic processes. These images are constructed by processing seismic wavefields recorded at the Earth's surface and generated by either active-source (e.g., vibroseis trucks) experiments or by natural (e.g., ocean waves) and anthropogenic (e.g., vehicle traffic) sources. Because our datasets are enormous, and wavefield propagation needs to be accurately modeled to achieve high-resolution imaging, we need to harness the power of the latest computational hardware to test our methods on field data. Therefore, mapping imaging algorithms into high-performance architecture is an essential component of our research. The amount and quality of information that we can extract from seismic data are directly linked to the temporal and spatial sampling of the sources and the receivers. In the past several years, we have been working on methods to process data recorded by using fiber cables as seismic sensors. Fiber-optic seismic recording promises to enable cost-effective continuous seismic monitoring at a large scale. A particularly exciting possibility is leveraging preexisting telecommunication infrastructure to record seismic data with dense arrays in urban environments continuously. In 2016 we pioneered that idea by recording data under the Stanford campus. Since then, we recorded data in San Jose and on a 48-km array under Stanford and neighboring cities. Education Ph.D, Stanford University, Geophysics  (1990) M.S., Stanford University, Geophysics  (1987) M.Sc., Politecnico di Milano, Electrical Engineering  (1984) Contact (650) 723-1319 biondo@stanford.edu Mail Code 2215 Links Stanford Exploration Project View Full Stanford Profile Back to Top",http://sep.sites.stanford.edu/
Eric Dunham,https://icme.stanford.edu/people/eric-dunham,"Main content start Professor of Geophysics Eric Dunham Professor of Geophysics My research focuses on the development and use of physics-based computational simulations to characterize and understand earthquakes, tsunamis, and volcanoes, and similar phenomena. My approach is to identify the fundamental mechanical processes governing a system of interest, develop numerical models incorporating these processes, validate them using geophysical observations, and then use the models to predict system behavior. Specific research areas include earthquake rupture dynamics and earthquake source processes, tsunami generation, volcano seismology and infrasound, ice stream stick-slip events and flexural-gravity waves in ice shelves, and numerical methods for wave propagation. Education Ph.D., University of California, Santa Barbara, Physics  (2005) B.S., University of Virginia, Physics  (2000) Contact (650) 725-6989 edunham@stanford.edu Mail Code 2215 Links Personal Website View Full Stanford Profile Back to Top",http://pangea.stanford.edu/~edunham/
Jerry Harris,https://icme.stanford.edu/people/jerry-harris,"Main content start The Cecil H. and Ida M. Green Professor in Geophysics, Emeritus Jerry Harris The Cecil H. and Ida M. Green Professor in Geophysics, Emeritus Jerry joined Stanford in 1988 after eleven years with private industry. He and his students, together known as the Stanford Wave Physics Lab, study the physics of seismic and electromagnetic waves and fields in complex media, including modeling, numerical simulations, and the processing and inversion of field data. Their recent work has focused on (1) fractional Laplacian formulations for Q modeling and Q compensated RTM, and (2) FWI with reduced order models with sparse parameterizations and machine-learned dictionaries derived from wave propagation kernels, geological, and dynamic flow processes. Jerry co-founded Stanford's Global Climate and Energy Project (GCEP), founded and served as Director of the Stanford Center for Computational Earth and Environmental Science (CEES), and founded the School’s summer undergraduate pathways program (SURGE). He has served as Geophysics department chair and SE3 Associate Dean. Education Ph.D, California Institute of Technology, Electrical Engineering  (1980) M.S., California Institute of Technology, Electrical Engineering  (1974) B.S., Electrical Engineering, University of Mississippi  (1973) Contact (650) 723-5002 jerry.harris@stanford.edu Mail Code 2215 Links Stanford Wave Physics Lab View Full Stanford Profile Back to Top",https://pangea.stanford.edu/researchgroups/swp/
Ching-Yao Lai,https://icme.stanford.edu/people/ching-yao-lai,"Main content start Assistant Professor of Geophysics Ching-Yao Lai Assistant Professor of Geophysics My group attacks fundamental questions in ice-dynamics, geophysics, and fluid dynamics by integrating mathematical and machine-learned models with observational data. We use our findings to address challenges facing the world, such as advancing our scientific knowledge of ice dynamics under climate change. The length scale of the systems we are interested in varies broadly from a few microns to thousands of kilometers, because the governing physical principles are often universal across a range of length and time scales. We use mathematical models, simulations, and machine learning to study the complex interactions between fluids and elasticity and their interfacial dynamics, such as multiphase flows, flows in deformable structures, and cracks. We extend our findings to tackle emerging topics in climate science and geophysics, such as understand the missing physics that governs the flow of ice sheets in a warming climate. We welcome collaborations across disciplinary lines, from geophysics, engineering, physics, applied math to computer science, since we believe combining expertise and methodologies across fields is crucial for new discoveries. Education Ph.D., Princeton University, Mechanical and Aerospace Engineering  (2018) B.S., National Taiwan University, Physics  (2013) Contact cyaolai@stanford.edu Mail Code 2215 Links Lai Research Group Website Google Scholar View Full Stanford Profile Back to Top",https://icyphysics.stanford.edu/
Jenny Suckale,https://icme.stanford.edu/people/jenny-suckale,"Main content start Associate Professor of Geophysics and, Senior Fellow, by courtesy, at the Woods Institute for the Environment Jenny Suckale Associate Professor of Geophysics and, Senior Fellow, by courtesy, at the Woods Institute for the Environment My research group studies disasters to reduce the risk they pose. We approach this challenge by developing customized mathematical models that can be tested against observational data and are informed by community needs through a scientific co-production process. We intentionally work on extremes across different natural systems rather than focusing on one specific natural system to identify both commonalities in the physical processes driving extremes and in the best practices for mitigating risk at the community level. Our current research priorities include volcanic eruptions, ice-sheet instability, permafrost disintegration, induced seismicity and flood-risk mitigation. I was recently awarded the Presidential Early Career Awards for Scientists and Engineers, the highest honor bestowed by the United States Government on science and engineering professionals in the early stages of their independent research careers and the CAREER award from the National Science Foundation. Education Ph.D, Massachusetts Institute of Technology, Geophysics  (2011) MPA, Harvard University, Kennedy School of Government, Master of Public Administration  (2006) M.Sc., Free University Berlin, Germany, Physics (with Distinction)  (2002) Contact (650) 497-6456 jsuckale@stanford.edu Mail Code 2215 Links Research Group, SIGMA View Full Stanford Profile Back to Top",https://pangea.stanford.edu/researchgroups/sigma/
Jose H. Blanchet,https://icme.stanford.edu/people/jose-blanchet,"Main content start Professor of Management Science and Engineering Jose H. Blanchet Professor of Management Science and Engineering Jose Blanchet is a Professor of Management Science and Engineering (MS&E) at Stanford and an Amazon Scholar. Prior to joining MS&E, he was a professor at Columbia (Industrial Engineering and Operations Research, and Statistics, 2008-2017), and before that he taught at Harvard (Statistics, 2004-2008). Jose is Fellow of the Institute of Mathematical Statistics. He is a recipient of the 2010 Erlang Prize and several best publication awards in areas such as applied probability, simulation, operations management, and revenue management. Jose also received a Presidential Early Career Award for Scientists and Engineers in 2010. He also has received numerous funding awards from various agencies and companies. He currently leads a Department of Defense Multi-University Research Initiative on extreme events. Jose has research interests in applied probability and Monte Carlo methods. He is the Area Editor of Stochastic Models in Mathematics of Operations Research. He has served on the editorial board of Advances in Applied Probability, Bernoulli, Extremes, Insurance: Mathematics and Economics, Journal of Applied Probability, Queueing Systems: Theory and Applications, and Stochastic Systems, among others. Education PhD, Stanford University, Management Science and Engineering  (2004) MS, Stanford University, Engineering Economic Systems and Operations Research  (2002) Licenciado, Instituto Technologico Autonomo de Mexico, Applied Mathematics  (2000) Licenciado, Instituto Technologico Autonomo de Mexico, Actuarial Science  (2000) Contact jblanche@stanford.edu Mail Code 4026 Links My Lab Site View Full Stanford Profile Back to Top",https://joseblanchet.com
Kay Giesecke,https://icme.stanford.edu/people/kay-giesecke,"Main content start Professor of Management Science and Engineering Kay Giesecke Professor of Management Science and Engineering Kay Giesecke is Professor of Management Science & Engineering at Stanford University. He is the Founder and Director of Stanford's Advanced Financial Technologies Laboratory, the Director of the Mathematical and Computational Finance Program and a member of the Institute for Computational and Mathematical Engineering. He has been on the Stanford faculty since 2005, and has held visiting positions at Cornell, UCLA, and the International Monetary Fund. He serves on the Governing Board and Scientific Advisory Board of the Consortium for Data Analytics in Risk and the Council of the Bachelier Finance Society. He is the founder and organizer of Stanford’s annual AI in Fintech Forum. Kay is Editor of Management Science (Finance Area) and Associate Editor for Operations Research, Mathematical Finance, Journal of Financial Econometrics, SIAM Journal on Financial Mathematics and several other leading journals. Giesecke’s award-winning research sits at the intersection of technology and finance, transforming risk intelligence, market oversight, and investment management. He pioneers stochastic models, statistical machine learning methods, computational algorithms, and software to better understand risk, identify opportunities, and support decision-making. Key application areas include risk management, market surveillance, fair lending, and sustainable investing. His work informs financial regulation, guides institutional practices, and contributes to more transparent, resilient, and equitable financial systems. In 2020, Kay founded Infima Technologies, a venture-backed SaaS company delivering transformative AI solutions for fixed-income market participants. He served as CEO before becoming Chief Scientist upon his return to Stanford. As Chairman of the Board, he led Infima through an acquisition in 2024. Kay has published more than 60 research articles in leading academic journals spanning stochastics, operations research, machine learning, econometrics, and financial economics. He is also a co-author of several U.S. patents, some of which underpin commercial investment analytics systems widely used in the financial industry. His research has been recognized with multiple awards, including the JP Morgan AI Faculty Research Award (2019), the SIAM Financial Mathematics and Engineering Conference Paper Prize (2014), the Fama/DFA Prize for the Best Asset Pricing Paper in the Journal of Financial Economics, and the Gauss Prize of the Society for Actuarial and Financial Mathematics of Germany (2003). His work is supported by the National Science Foundation and several leading financial institutions. Kay has supervised 27 doctoral dissertations, with graduates going on to faculty positions at institutions such as UC Berkeley, Oxford, Wharton, and NYU; leadership roles at firms including Goldman Sachs, Google, JPMorgan, Amazon, and Morgan Stanley; and founding successful technology startups. Kay is an award-winning educator with extensive experience designing educational programs at all levels. He has created and led successful executive education initiatives that have attracted industry leaders from around the globe. Kay advises several venture-backed technology startups and has served as a consultant to banks, investment managers, software firms, government agencies, and supranational organizations. Kay received his doctorate in 2001 from Humboldt Universität zu Berlin where he was a fellow of the Deutsche Forschungsgemeinschaft. Education PhD, Humboldt University Berlin, Germany, Economics  (2001) Contact (650) 723-9265 giesecke@stanford.edu Mail Code 4026 Links Kay's personal website Advanced Financial Technologies Laboratory Mathematical and Computational Finance Program View Full Stanford Profile Back to Top",https://people.stanford.edu/giesecke/
Peter Glynn,https://icme.stanford.edu/people/peter-glynn,"Main content start Thomas W. Ford Professor in the School of Engineering and Professor, by courtesy, of Electrical Engineering Peter Glynn Thomas W. Ford Professor in the School of Engineering and Professor, by courtesy, of Electrical Engineering Peter W. Glynn is the Thomas Ford Professor in the Department of Management Science and Engineering (MS&E) at Stanford University, and also holds a courtesy appointment in the Department of Electrical Engineering.. He received his Ph.D in Operations Research from Stanford University in 1982. He then joined the faculty of the University of Wisconsin at Madison, where he held a joint appointment between the Industrial Engineering Department and Mathematics Research Center, and courtesy appointments in Computer Science and Mathematics. In 1987, he returned to Stanford, where he joined the Department of Operations Research. From 1999 to 2005, he served as Deputy Chair of the Department of Management Science and Engineering, and was Director of Stanford's Institute for Computational and Mathematical Engineering from 2006 until 2010. He served as Chair of MS&E from 2011 through 2015. He is a Fellow of INFORMS and a Fellow of the Institute of Mathematical Statistics, has been co-winner of Best Publication Awards from the INFORMS Simulation Society in 1993 and 2008, was a co-winner of the Best (Biannual) Publication Award from the INFORMS Applied Probability Society in 2009, and was the co-winner of the John von Neumann Theory Prize from INFORMS in 2010. In 2012, he was elected to the National Academy of Engineering. His research centers on computational algorithms, mathematical approximations, statistical methodology, and optimization methods for the analysis of systems in which uncertainty is present. He has developed algorithms that are widely used across the field of Monte Carlo simulation. Applications include financial risk management, service systems engineering, logistics, and retail operations. Education PhD, Stanford University, Operations Research  (1982) B.Sc (Hon), Carleton University, Mathematics  (1978) Contact glynn@stanford.edu Mail Code 4026 Links https://web.stanford.edu/~glynn/ View Full Stanford Profile Back to Top",https://web.stanford.edu/~glynn/ https://web.stanford.edu/
Ashish Goel,https://icme.stanford.edu/people/ashish-goel,"Main content start Professor of Management Science and Engineering and, by courtesy, of Computer Science Ashish Goel Professor of Management Science and Engineering and, by courtesy, of Computer Science Ashish Goel is a Professor of Management Science and Engineering and (by courtesy) Computer Science at Stanford University. He received his PhD in Computer Science from Stanford in 1999, and was an Assistant Professor of Computer Science at the University of Southern California from 1999 to 2002. His research interests lie in the design, analysis, and applications of algorithms. Education PhD, Stanford University, Computer Science  (1999) Contact ashish.goel@stanford.edu Mail Code 4026 Links https://web.stanford.edu/~ashishg/ashishg.html View Full Stanford Profile Back to Top",https://web.stanford.edu/~ashishg/ashishg.html https://web.stanford.edu/
Ramesh Johari,https://icme.stanford.edu/people/ramesh-johari,"Main content start Professor of Management Science and Engineering and, by courtesy, of Electrical Engineering Ramesh Johari Professor of Management Science and Engineering and, by courtesy, of Electrical Engineering Johari is broadly interested in the design, economic analysis, and operation of online platforms, as well as statistical and machine learning techniques used by these platforms (such as search, recommendation, matching, and pricing algorithms). Education PhD, MIT (2004) Contact (650) 723-0937 rjohari@stanford.edu Mail Code 4026 Links https://web.stanford.edu/people/ramesh.johari View Full Stanford Profile Back to Top",https://web.stanford.edu/people/ramesh.johari
